Product,Count,Price
"Newman's Own Organics Coffee Special Blend K-Cup Pod,",80-count,$31.99
"Kirkland Signature, Organic Applesauce, 3.17 oz,",24-Count,$12.99
"Kirkland Signature, Organic Extra Virgin Olive Oil, 2 L",,$22.99
"Kirkland Signature Organic Peanut Butter, 28 oz,",2-count,$12.99
"Kirkland Signature Organic Roasted Seaweed, 0.6 oz,",10-count,$12.49
"Kirkland Signature, Organic Almond Beverage, Vanilla, 32 fl oz,",6-Count,$9.99
"Peet's Coffee Organic Alma De La Tierra K-Cup Pod,",60-count,$39.99
"Garofalo, Organic Pasta, Variety Pack, 17.6 oz,",6-Count,$12.99
"Kirkland Signature Organic Pine Nuts, 1.5 lbs",,$29.99
Ruta Maya Organic Medium Roast Whole Bean Coffee 5 lb,,$44.99
Ruta Maya Organic Jiguaní Whole Bean Coffee 5 lb,,$47.99
"Kirkland Signature Organic Pure Maple Syrup, 33.8 oz",,$14.99
"Kirkland Signature Organic Animal Crackers, 4 lbs",,$12.99
"Kirkland Signature, Organic Chicken Stock, 32 fl oz,",6-Count,$11.99
"Made In Nature Organic Calimyrna Figs 40 oz, 3-pack",,$49.99
"Kirkland Signature Organic Raw Honey, 24 oz,",3-count,$14.99
"Seeds of Change, Organic Quinoa and Brown Rice with Garlic, 8.5 oz Pouch,",6-Count,$14.99
"Jose’s 100% Organic Mayan Whole Bean Coffee 2.5 lb, 2-pack",,$44.99
"Thai Kitchen Organic Coconut Milk, Unsweetened, 13.66 fl oz,",6-count,$12.99
"Kirkland Signature, Organic Tomato Sauce, 15 oz,",12-Count,$13.99
"Made in Nature Organic Berry Fusion 24 oz, 2-pack",,$39.99
"Kirkland Signature, Organic Fruit and Vegetable Pouches, Variety Pack, 3.17 oz,",24-count,$14.99
"Kirkland Signature, Organic Sugar, 10 lbs",,$10.99
"S&W, Organic Black Beans, 15 oz,",8-Count,$9.99
"Kirkland Signature, Organic Soy Beverage, Vanilla, 32 fl oz,",12-Count,$17.99
"Kirkland Signature, Organic Tomato Paste, 6 oz,",12-Count,$10.99
"Oregon Chai, Original Organic Chai Tea Latte Concentrate, 32 fl. oz.,",3-Count,$11.69
"Kirkland Signature Organic Blue Agave, 36 oz,",2-count,$10.99
"S&W, Organic Garbanzo Beans, 15.5 oz,",8-Count,$9.99
"Kirkland Signature Organic No-Salt Seasoning, 14.5 oz",,$9.99
"Ruta Maya Organic Dark Roast Coffee, 5 lbs",,$44.99
"Kirkland Signature, Organic Soy Beverage, Plain, 32 fl oz,",12-Count,$17.99
"Mother Earth Organic Medium Roast Coffee 2 lb, 2-pack",,$39.99
