Product Name,Price,Product Link
"Newman's Own Organics Coffee Special Blend K-Cup Pod, 80-count",$31.99,/all-costco-grocery.html
"Kirkland Signature, Organic Applesauce, 3.17 oz, 24-Count",$12.99,/all-costco-grocery.html
"Kirkland Signature, Organic Extra Virgin Olive Oil, 2 L",$22.99,/all-costco-grocery.html
"Kirkland Signature Organic Peanut Butter, 28 oz, 2-count",$12.99,/all-costco-grocery.html
"Kirkland Signature Organic Roasted Seaweed, 0.6 oz, 10-count",$12.49,/all-costco-grocery.html
"Kirkland Signature, Organic Almond Beverage, Vanilla, 32 fl oz, 6-Count",$9.99,/all-costco-grocery.html
"Peet's Coffee Organic Alma De La Tierra K-Cup Pod, 60-count",$39.99,https://www.costco.com/peet's-coffee-organic-alma-de-la-tierra-k-cup-pod%2c-60-count.product.100383895.html
"Garofalo, Organic Pasta, Variety Pack, 17.6 oz, 6-Count",$12.99,/all-costco-grocery.html
"Kirkland Signature Organic Pine Nuts, 1.5 lbs",$29.99,/all-costco-grocery.html
Ruta Maya Organic Medium Roast Whole Bean Coffee 5 lb,$44.99,https://www.costco.com/ruta-maya-organic-medium-roast-whole-bean-coffee-5-lb.product.100041370.html
Ruta Maya Organic Jiguaní Whole Bean Coffee 5 lb,$47.99,https://www.costco.com/ruta-maya-organic-jiguan%c3%ad-whole-bean-coffee-5-lb.product.100123782.html
"Kirkland Signature Organic Pure Maple Syrup, 33.8 oz",$14.99,/all-costco-grocery.html
"Kirkland Signature Organic Animal Crackers, 4 lbs",$12.99,/all-costco-grocery.html
"Kirkland Signature, Organic Chicken Stock, 32 fl oz, 6-Count",$11.99,/all-costco-grocery.html
"Made In Nature Organic Calimyrna Figs 40 oz, 3-pack",$49.99,https://www.costco.com/made-in-nature-organic-calimyrna-figs-40-oz%2c-3-pack.product.100038876.html
"Kirkland Signature Organic Raw Honey, 24 oz, 3-count",$14.99,/all-costco-grocery.html
"Seeds of Change, Organic Quinoa and Brown Rice with Garlic, 8.5 oz Pouch, 6-Count",$14.99,/all-costco-grocery.html
"Jose’s 100% Organic Mayan Whole Bean Coffee 2.5 lb, 2-pack",$44.99,https://www.costco.com/jose%e2%80%99s-100%25-organic-mayan-whole-bean-coffee-2.5-lb%2c-2-pack.product.100123756.html
"Thai Kitchen Organic Coconut Milk, Unsweetened, 13.66 fl oz, 6-count",$12.99,/all-costco-grocery.html
"Kirkland Signature, Organic Tomato Sauce, 15 oz, 12-Count",$13.99,/all-costco-grocery.html
"Made in Nature Organic Berry Fusion 24 oz, 2-pack",$39.99,https://www.costco.com/made-in-nature-organic-berry-fusion-24-oz%2c-2-pack.product.100163336.html
"Kirkland Signature, Organic Fruit and Vegetable Pouches, Variety Pack, 3.17 oz, 24-count",$14.99,/all-costco-grocery.html
"Kirkland Signature, Organic Sugar, 10 lbs",$10.99,/all-costco-grocery.html
"S&W, Organic Black Beans, 15 oz, 8-Count",$9.99,/all-costco-grocery.html
"Kirkland Signature, Organic Soy Beverage, Vanilla, 32 fl oz, 12-Count",$17.99,/all-costco-grocery.html
"Kirkland Signature, Organic Tomato Paste, 6 oz, 12-Count",$10.99,/all-costco-grocery.html
"Oregon Chai, Original Organic Chai Tea Latte Concentrate, 32 fl. oz., 3-Count",$11.69,/all-costco-grocery.html
"Kirkland Signature Organic Blue Agave, 36 oz, 2-count",$10.99,/all-costco-grocery.html
"S&W, Organic Garbanzo Beans, 15.5 oz, 8-Count",$9.99,/all-costco-grocery.html
"Kirkland Signature Organic No-Salt Seasoning, 14.5 oz",$9.99,/all-costco-grocery.html
"Ruta Maya Organic Dark Roast Coffee, 5 lbs",$44.99,https://www.costco.com/ruta-maya-organic-dark-roast-coffee%2c-5-lbs.product.100041391.html
"Kirkland Signature, Organic Soy Beverage, Plain, 32 fl oz, 12-Count",$17.99,/all-costco-grocery.html
"Mother Earth Organic Medium Roast Coffee 2 lb, 2-pack",$39.99,https://www.costco.com/mother-earth-organic-medium-roast-coffee-2-lb%2c-2-pack.product.100320592.html
